{
  "department": "philosophy",
  "grammar_version": "1.0.0",
  "hypothesis_weights": {
    "inductive": 0.15,
    "deductive": 0.35,
    "abductive": 0.20,
    "analogical": 0.20,
    "combinatorial": 0.10
  },
  "test_weights": {
    "empirical": 0.05,
    "formal_proof": 0.15,
    "simulation": 0.00,
    "thought_experiment": 0.50,
    "cross_validation": 0.15,
    "adversarial": 0.15
  },
  "metadata": {
    "last_updated": "2026-03-18",
    "cycle_count": 0,
    "total_T": 0,
    "total_F": 0,
    "total_U": 0,
    "total_C": 0
  }
}
